{
  "version": 1,
  "title": "Nightly job reads the inventory",
  "actors": [
    {
      "id": "job",
      "label": "Batch job",
      "short": "JOB",
      "kind": "service"
    },
    {
      "id": "idp",
      "label": "Authorization server",
      "short": "AS",
      "kind": "idp"
    },
    {
      "id": "api",
      "label": "Inventory API",
      "short": "API",
      "kind": "resource"
    }
  ],
  "steps": [
    {
      "type": "message",
      "from": "job",
      "to": "idp",
      "label": "/token",
      "tone": "info",
      "detail": "client_credentials + private_key_jwt",
      "token": "client assertion",
      "story": {
        "title": "The job authenticated as itself",
        "what": "The job signed a short-lived JWT with its private key and asked for a token.",
        "why": "No user is involved; the workload is the principal.",
        "matters": "Key-based client auth means no shared secret to leak or rotate by hand."
      }
    },
    {
      "type": "event",
      "at": "idp",
      "label": "mints token",
      "tone": "ok",
      "token": "access token"
    },
    {
      "type": "message",
      "from": "idp",
      "to": "job",
      "label": "access_token",
      "tone": "ok",
      "return": true
    },
    {
      "type": "message",
      "from": "job",
      "to": "api",
      "label": "GET /inventory",
      "tone": "ok",
      "detail": "Bearer access_token",
      "token": "access token",
      "story": {
        "title": "The API saw a machine, not a person",
        "what": "The token's sub is the client itself.",
        "why": "Client credentials tokens carry no user identity.",
        "matters": "Grant these narrowly: there is no user whose limits bound them."
      }
    },
    {
      "type": "event",
      "at": "api",
      "label": "200 OK",
      "tone": "ok",
      "token": "200 OK"
    }
  ],
  "subtitle": "OAuth 2.0 client credentials grant (machine to machine)",
  "tags": [
    "M2M",
    "client credentials",
    "private_key_jwt"
  ],
  "outcome": {
    "status": "allow",
    "detail": "The workload authenticated with its key and received a token scoped to inventory reads.",
    "caption": "client authenticated · token minted · API returned 200"
  },
  "tokens": [
    {
      "label": "Access token",
      "raw": "eyJhbGciOiJSUzI1NiIsImtpZCI6ImV4YW1wbGUta2V5LTEiLCJ0eXAiOiJKV1QifQ.eyJpc3MiOiJodHRwczovL2FzLmV4YW1wbGUuY29tIiwic3ViIjoiYmF0Y2gtam9iLWNsaWVudCIsImF1ZCI6ImludmVudG9yeSIsInNjb3BlIjoiaW52ZW50b3J5LnJlYWQiLCJpYXQiOjE3NjcyMjU2MDAsImV4cCI6MTc2NzIyOTIwMH0.REDACTED-SIGNATURE",
      "show": [
        "sub",
        "aud",
        "scope",
        "exp"
      ],
      "note": "sub is the client: there is no user in this token."
    }
  ]
}
