{
  "version": 1,
  "title": "Agent tries to update a ticket for Susan",
  "actors": [
    {
      "id": "user",
      "label": "Susan (user)",
      "short": "USER",
      "kind": "user"
    },
    {
      "id": "agent",
      "label": "AI agent",
      "short": "AGENT",
      "kind": "agent",
      "description": "An MCP client, e.g. a coding assistant"
    },
    {
      "id": "gw",
      "label": "MCP gateway",
      "short": "GATEWAY",
      "kind": "gateway",
      "description": "Brokers tokens for the agent"
    },
    {
      "id": "idp",
      "label": "Identity provider",
      "short": "IDP",
      "kind": "idp",
      "sublabel": "org + resource AS"
    },
    {
      "id": "api",
      "label": "Ticket API",
      "short": "API",
      "kind": "resource",
      "sublabel": "MCP server"
    }
  ],
  "steps": [
    {
      "type": "message",
      "from": "user",
      "to": "agent",
      "label": "ask agent",
      "detail": "\"update ticket 42\"",
      "story": {
        "title": "You asked the agent",
        "what": "Susan asked the agent to work with ticket 42.",
        "why": "The agent has no rights of its own here. It acts strictly on Susan's behalf.",
        "matters": "Every agent action traces back to a real person and inherits that person's limits."
      }
    },
    {
      "type": "message",
      "from": "agent",
      "to": "gw",
      "label": "tools/call",
      "tone": "info",
      "detail": "tickets.update"
    },
    {
      "type": "message",
      "from": "gw",
      "to": "idp",
      "label": "ID-JAG request",
      "tone": "info",
      "detail": "grant=token-exchange",
      "token": "user ⊕ agent",
      "story": {
        "title": "The gateway brokered the request to the identity provider",
        "what": "The gateway presented Susan's identity and the agent's own credentials, asking for an Identity Assertion JWT (ID-JAG).",
        "why": "An agent can't mint its own access. Only the identity provider issues tokens, and only after evaluating policy.",
        "matters": "The exchange is the checkpoint: every agent action passes through policy before it can touch a resource."
      }
    },
    {
      "type": "event",
      "at": "idp",
      "label": "mints ID-JAG",
      "tone": "info",
      "token": "ID-JAG"
    },
    {
      "type": "message",
      "from": "gw",
      "to": "idp",
      "label": "token exchange",
      "tone": "info",
      "detail": "grant=jwt-bearer"
    },
    {
      "type": "event",
      "at": "idp",
      "label": "narrows scopes",
      "tone": "ok",
      "token": "scoped token",
      "story": {
        "title": "The identity provider minted a narrow token",
        "what": "A token for the ticket API was issued, but the agent's connection is limited below Susan, so it carries only tickets.read.",
        "why": "The token is the intersection of what the user may do and what this agent may do.",
        "matters": "Even though Susan may update tickets, this agent may not. The limit is in the token itself."
      }
    },
    {
      "type": "message",
      "from": "gw",
      "to": "api",
      "label": "call tickets.update",
      "tone": "info",
      "detail": "+ access token",
      "token": "access token"
    },
    {
      "type": "event",
      "at": "api",
      "label": "403 insufficient_scope",
      "tone": "deny",
      "token": "403",
      "story": {
        "title": "The ticket API refused the call (403)",
        "what": "The API checked the token, found no tickets.write scope, and refused.",
        "why": "Resources enforce scope on every call.",
        "matters": "The agent limit is not a policy note. It is a machine-checked refusal at the resource.",
        "status": "deny"
      }
    },
    {
      "type": "message",
      "from": "api",
      "to": "gw",
      "label": "refused",
      "tone": "deny",
      "return": true
    }
  ],
  "subtitle": "Cross App Access: ID-JAG token exchange through an MCP gateway",
  "tags": [
    "agentic",
    "XAA / ID-JAG",
    "RFC 8693",
    "RFC 7523"
  ],
  "outcome": {
    "status": "refused",
    "headline": "✕ REFUSED: AGENT LIMITED",
    "detail": "A token was minted, but the agent's connection is limited below Susan, so it lacked tickets.write and the API refused.",
    "caption": "token minted but narrower than the user · API refused (403)"
  },
  "tokens": [
    {
      "label": "Delegated access token",
      "raw": "eyJhbGciOiJSUzI1NiIsImtpZCI6ImV4YW1wbGUta2V5LTEiLCJ0eXAiOiJKV1QifQ.eyJpc3MiOiJodHRwczovL2lkcC5leGFtcGxlLmNvbS9vYXV0aDIvdGlja2V0cy1hcyIsInN1YiI6InN1c2FuQGV4YW1wbGUuY29tIiwiYXVkIjoiYXBpOi8vdGlja2V0cyIsImNpZCI6ImFpLWFnZW50LTdmM2EiLCJzY3AiOlsidGlja2V0cy5yZWFkIl0sImFjdCI6eyJzdWIiOiJhaS1hZ2VudC03ZjNhIn0sImlhdCI6MTc2NzIyNTYwMCwiZXhwIjoxNzY3MjI5MjAwfQ.REDACTED-SIGNATURE",
      "show": [
        "sub",
        "act",
        "aud",
        "iss",
        "scope",
        "exp"
      ],
      "missing": [
        "tickets.write"
      ],
      "note": "sub is the user; act.sub is the agent acting on their behalf (RFC 8693 actor claim)."
    }
  ]
}
